message,target
Ok im not sure what time i finish tomorrow but i wanna spend the evening with you cos that would be vewy vewy lubly! Love me xxx,0
Got it! It looks scrumptious... daddy wants to eat you all night long!,0
Bought one ringtone and now getting texts costing 3 pound offering more tones etc,1
"You've won tkts to the EURO2004 CUP FINAL or £800 CASH, to collect CALL 09058099801 b4190604, POBOX 7876150ppm",1
Is ur changes 2 da report big? Cos i've already made changes 2 da previous report.,0
Txt: CALL to No: 86888 & claim your reward of 3 hours talk time to use from your phone now! Subscribe6GBP/mnth inc 3hrs 16 stop?txtStop www.gamb.tv,1
Apps class varaya elaya.,0
Our brand new mobile music service is now live. The free music player will arrive shortly. Just install on your phone to browse content from the top artists.,1
Still at west coast... Haiz... Ü'll take forever to come back...,0
Maybe you should find something else to do instead???,0
When are you going to ride your bike?,0
See you there! ,0
You can donate £2.50 to UNICEF's Asian Tsunami disaster support fund by texting DONATE to 864233. £2.50 will be added to your next bill,1
I'm at bruce &amp; fowler now but I'm in my mom's car so I can't park (long story),0
"Dunno, my dad said he coming home 2 bring us out 4 lunch. Yup i go w u lor. I call u when i reach school lor...",0
Tell me pa. How is pain de.,0
Why you keeping me away like this,0
Da is good good player.why he is unsold.,0
HIYA COMIN 2 BRISTOL 1 ST WEEK IN APRIL. LES GOT OFF + RUDI ON NEW YRS EVE BUT I WAS SNORING.THEY WERE DRUNK! U BAK AT COLLEGE YET? MY WORK SENDS INK 2 BATH.,0
"A cute thought for friendship: ""Its not necessary to share every secret with ur close Frnd, but watever u shared should be true""....",0
"Short But Cute: ""Be a good person, but dont try to prove it.."" .Gud noon....",0
.Please charge my mobile when you get up in morning.,0
Love it! I want to flood that pretty pussy with cum...,0
Cuz ibored. And don wanna study,0
You have 1 new message. Please call 08715205273,1
Even u dont get in trouble while convincing..just tel him once or twice and just tel neglect his msgs dont c and read it..just dont reply,0
Pls speak with me. I wont ask anything other then you friendship.,0
Is avatar supposed to have subtoitles,0
i felt so...not any conveying reason.. Ese he... What about me?,0
Double Mins & Double Txt & 1/2 price Linerental on Latest Orange Bluetooth mobiles. Call MobileUpd8 for the very latest offers. 08000839402 or call2optout/LF56,1
Rofl betta invest in some  anti aging products,0
Shall i come to get pickle,0
Hope you enjoyed your new content. text stop to 61610 to unsubscribe. help:08712400602450p Provided by tones2you.co.uk,1
"You are being contacted by our dating service by someone you know! To find out who it is, call from a land line 09050000878. PoBox45W2TG150P",1
Eat at old airport road... But now 630 oredi... Got a lot of pple...,0
Pass dis to all ur contacts n see wat u get! Red;i'm in luv wid u. Blue;u put a smile on my face. Purple;u r realy hot. Pink;u r so swt. Orange;i thnk i lyk u. Green;i realy wana go out wid u. Yelow;i wnt u bck. Black;i'm jealous of u. Brown;i miss you Nw plz giv me one color,0
"Goodnight, sleep well da please take care pa. Please.",0
MAKE SURE ALEX KNOWS HIS BIRTHDAY IS OVER IN FIFTEEN MINUTES AS FAR AS YOU'RE CONCERNED,0
You tell what happen dont behave like this to me. Ok no need to say,0
I have no idea where you are,0
We'll join the  &lt;#&gt;  bus,0
"Just wondering, the others just took off",0
Can you let me know details of fri when u find out cos I'm not in tom or fri. mentionned chinese. Thanks,0
Great News! Call FREEFONE 08006344447 to claim your guaranteed £1000 CASH or £2000 gift. Speak to a live operator NOW!,1
Oh:)as usual vijay film or its different?,0
Yo do you know anyone  &lt;#&gt;  or otherwise able to buy liquor? Our guy flaked and right now if we don't get a hold of somebody its just 4 loko all night,0
"I'm done. I'm sorry. I hope your next space gives you everything you want. Remember all the furniture is yours. If i'm not around when you move it, just lock all the locks and leave the key with jenne.",0
You got job in wipro:)you will get every thing in life in 2 or 3 years.,0
Also hi wesley how've you been,0
Full heat pa:-) i have applyed oil pa.,0
"I can't keep going through this. It was never my intention to run you out, but if you choose to do that rather than keep the room clean so *I* don't have to say no to visitors, then maybe that's the best choice. Yes, I wanted you to be embarassed, so maybe you'd feel for once how I feel when i have a friend who wants to drop buy and i have to say no, as happened this morning. I've tried everything. I don't know what else to do.",0
As per your request 'Melle Melle (Oru Minnaminunginte Nurungu Vettam)' has been set as your callertune for all Callers. Press *9 to copy your friends Callertune,0
Its a valentine game. . . send dis msg to all ur friends. . If 5 answers r d same then someone really loves u. . Ques- which colour suits me the best?,0
I have to take exam with march 3,0
Okay... We wait ah,0
"Dear,Me at cherthala.in case u r coming cochin pls call bfore u start.i shall also reach accordingly.or tell me which day u r coming.tmorow i am engaged ans its holiday.",0
The message sent is askin for  &lt;#&gt; dollars. Shoul i pay  &lt;#&gt;  or  &lt;#&gt; ?,0
I also thk too fast... Xy suggest one not me. U dun wan it's ok. Going 2 rain leh where got gd.,0
"Dont search love, let love find U. Thats why its called falling in love, bcoz U dont force yourself, U just fall and U know there is smeone to hold U... BSLVYL",0
Free tones Hope you enjoyed your new content. text stop to 61610 to unsubscribe. help:08712400602450p Provided by tones2you.co.uk,1
Oh dang! I didn't mean o send that to you! Lol!,0
Hai dear friends... This is my new &amp; present number..:) By Rajitha Raj (Ranju),0
Okie... Thanx...,0
Olol i printed out a forum post by a guy with the exact same  prob which was fixed with a gpu replacement. Hopefully they dont ignore that.,0
I'm very happy for you babe ! Woo hoo party on dude!,0
You stayin out of trouble stranger!!saw Dave the other day hes sorted now!still with me bloke when u gona get a girl MR!ur mum still Thinks we will get 2GETHA! ,0
I dont thnk its a wrong calling between us,0
What's up my own oga. Left my phone at home and just saw ur messages. Hope you are good. Have a great weekend.,0
"In The Simpsons Movie released in July 2007 name the band that died at the start of the film? A-Green Day, B-Blue Day, C-Red Day. (Send A, B or C)",1
Yo we are watching a movie on netflix,0
Beauty sleep can help ur pimples too.,0
I want to be there so i can kiss you and feel you next to me,0
Near kalainar tv office.thenampet,0
HI BABE IM AT HOME NOW WANNA DO SOMETHING? XX,0
And you! Will expect you whenever you text! Hope all goes well tomo ,0
"Did he say how fantastic I am by any chance, or anything need a bigger life lift as losing the will 2 live, do you think I would be the first person 2 die from N V Q? ",0
Hey what are you doing. Y no reply pa..,0
WIN URGENT! Your mobile number has been awarded with a £2000 prize GUARANTEED call 09061790121 from land line. claim 3030 valid 12hrs only 150ppm ,1
PRIVATE! Your 2003 Account Statement for 078,1
"It‘s £6 to get in, is that ok?",0
TELL HER I SAID EAT SHIT.,0
Was playng 9 doors game and gt racing on phone lol,0
"To the wonderful Okors, have a great month. We cherish you guys and wish you well each day. MojiBiola",0
Okie,0
:-( that's not v romantic!,0
Jesus christ bitch I'm trying to give you drugs answer your fucking phone,0
Hi good mornin.. Thanku wish u d same..,0
Yes i think so. I am in office but my lap is in room i think thats on for the last few days. I didnt shut that down,0
"Double mins and txts 4 6months FREE Bluetooth on Orange. Available on Sony, Nokia Motorola phones. Call MobileUpd8 on 08000839402 or call2optout/N9DX",1
Yar lor wait 4 my mum 2 finish sch then have lunch lor... I whole morning stay at home clean my room now my room quite clean... Hee...,0
I dont want to hear anything,0
"Dear Hero,i am leaving to qatar tonite for an apt opportunity.pls do keep in touch at  &lt;EMAIL&gt; ,kerala",0
"Usf I guess, might as well take 1 car",0
Did u got that persons story,0
She.s fine. I have had difficulties with her phone. It works with mine. Can you pls send her another friend request.,0
A little. Meds say take once every 8 hours. It's only been 5 but pain is back. So I took another. Hope I don't die,0
"Sorry, I can't help you on this.",0
He neva grumble but i sad lor... Hee... Buy tmr lor aft lunch. But we still meetin 4 lunch tmr a not. Neva hear fr them lei. Ü got a lot of work ar?,0
God bless.get good sleep my dear...i will pray!,0
"Yar lor he wan 2 go c horse racing today mah, so eat earlier lor. I ate chicken rice. U?",0
To day class is there are no class.,0
Purity of friendship between two is not about smiling after reading the forwarded message..Its about smiling just by seeing the name. Gud evng musthu,0
I'm ok. Will do my part tomorrow,0
Does daddy have a bb now.,0
No..jst change tat only..,0
"Yeah I think my usual guy's still passed out from last night, if you get ahold of anybody let me know and I'll throw down",0
Ok no prob...,0
S:)8 min to go for lunch:),0
Waiting for your call.,0
I've got it down to a tea. not sure which flavour,0
Would really appreciate if you call me. Just need someone to talk to.,0
You didn't have to tell me that...now i'm thinking. Plus he's going to stop all your runs,0
But your brother transfered only  &lt;#&gt;  +  &lt;#&gt; . Pa.,0
Hi its LUCY Hubby at meetins all day Fri & I will B alone at hotel U fancy cumin over? Pls leave msg 2day 09099726395 Lucy x Calls£1/minMobsmoreLKPOBOX177HP51FL,1
"FREE GAME. Get Rayman Golf 4 FREE from the O2 Games Arcade. 1st get UR games settings. Reply POST, then save & activ8. Press 0 key for Arcade. Termsapply",1
Most of the tiime when i don't let you hug me it's so i don't break into tears.,0
How long does applebees fucking take,0
How do friends help us in problems? They give the most stupid suggestion that Lands us into another problem and helps us forgt the previous problem,0
Where are you ? What are you doing ? Are yuou working on getting the pc to your mom's ? Did you find a spot that it would work ? I need you,0
"Sorry, I'll call later in meeting",0
"Sorry, I'll call later",0
"sir, you will receive the account no another 1hr time. Sorry for the delay.",0
I'll text now! All creepy like so he won't think that we forgot,0
Thanx...,0
Eh ur laptop got no stock lei... He say mon muz come again to take a look c got a not...,0
You should change your fb to jaykwon thuglyfe falconerf,0
"Sorry da thangam, very very sorry i am held up with prasad.",0
"K I'll head out in a few mins, see you there",0
Sunshine Quiz! Win a super Sony DVD recorder if you canname the capital of Australia? Text MQUIZ to 82277. B,1
"Cool, we shall go and see, have to go to tip anyway. Are you at home, got something to drop in later? So lets go to town tonight! Maybe mum can take us in.",0
"SPJanuary Male Sale! Hot Gay chat now cheaper, call 08709222922. National rate from 1.5p/min cheap to 7.8p/min peak! To stop texts call 08712460324 (10p/min)",1
They will pick up and drop in car.so no problem..,0
We still on for tonight?,0
tap & spile at seven. * Is that pub on gas st off broad st by canal. Ok?,0
"whatever, im pretty pissed off.",0
"Yup, no need. I'll jus wait 4 e rain 2 stop.",0
Nt yet chikku..simple habba..hw abt u?,0
"Tunde, how are you doing. This is just wishing you a great day. Abiola.",0
"Fyi I'm taking a quick shower, be at epsilon in like  &lt;#&gt;  min",0
Check mail.i have mailed varma and kept copy to you regarding membership.take care.insha allah.,0
"Japanese Proverb: If one Can do it, U too Can do it, If none Can do it,U must do it Indian version: If one Can do it, LET HIM DO it.. If none Can do it,LEAVE it!! And finally Kerala version: If one can do it, Stop him doing it.. If none can do it, Make a strike against it ...",0
8007 FREE for 1st week! No1 Nokia tone 4 ur mob every week just txt NOKIA to 8007 Get txting and tell ur mates www.getzed.co.uk POBox 36504 W4 5WQ norm 150p/tone 16+,1
The greatest test of courage on earth is to bear defeat without losing heart....gn tc,0
"Nope. Since ayo travelled, he has forgotten his guy",0
"Sorry my roommates took forever, it ok if I come by now?",0
Ok i also wan 2 watch e 9 pm show...,0
"Ok, be careful ! Don't text and drive !",0
I sent them. Do you like?,0
Exactly. Anyways how far. Is jide her to study or just visiting,0
I'm really not up to it still tonight babe,0
"Frnd s not juz a word.....not merely a relationship.....its a silent promise which says ... "" I will be with YOU "" Wherevr.. Whenevr.. Forevr... Gudnyt dear..",0
I pocked you up there before,0
I want snow. It's just freezing and windy.,0
"URGENT!! Your 4* Costa Del Sol Holiday or £5000 await collection. Call 09050090044 Now toClaim. SAE, TC s, POBox334, Stockport, SK38xh, Cost£1.50/pm, Max10mins",1
"I'd say that's a good sign but, well, you know my track record at reading women",0
"Forgot you were working today! Wanna chat, but things are ok so drop me a text when you're free / bored etc and i'll ring. Hope all is well, nose essay and all xx",0
"There'll be a minor shindig at my place later tonight, you interested?",0
Please don't text me anymore. I have nothing else to say.,0
i can call in  &lt;#&gt;  min if thats ok,0
"Shit that is really shocking and scary, cant imagine for a second. Def up for night out. Do u think there is somewhere i could crash for night, save on taxi?",0
Ok.. Ü finishing soon?,0
Lmao. Take a pic and send it to me.,0
Oh ok..,0
Actually i'm waiting for 2 weeks when they start putting ad.,0
"Good afternoon, my love. How goes your day ? What are you up to ? I woke early and am online waiting for you ... Hmmm ... Italian boy is online I see . *grins*",0
They r giving a second chance to rahul dengra.,0
Hi here. have birth at on the  to  at 8lb 7oz. Mother and baby doing brilliantly.,0
"I don,t think so. You don't need to be going out that late on a school night. ESPECIALLY when the one class you have is the one you missed last wednesday and probably failed a test in on friday",0
"A bit of Ur smile is my hppnss, a drop of Ur tear is my sorrow, a part of Ur heart is my life, a heart like mine wil care for U, forevr as my GOODFRIEND",0
"That means you got an A in epi, she.s fine. She.s here now.",0
Are you this much buzy,0
"As I entered my cabin my PA said, '' Happy B'day Boss !!''. I felt special. She askd me 4 lunch. After lunch she invited me to her apartment. We went there.",0
U coming 2 pick me?,0
"Not yet chikku..k, then wat abt tht guy did he stopped irritating or msging to u..",0
Thanks for being there for me just to talk to on saturday. You are very dear to me. I cherish having you as a brother and role model.,0
Good evening! this is roger. How are you?,0
"Living is very simple.. Loving is also simple.. Laughing is too simple.. Winning is tooo simple.. But, Being 'SIMPLE' is very difficult...;-) :-)",0
Aiyar sorry lor forgot 2 tell u...,0
We tried to call you re your reply to our sms for a video mobile 750 mins UNLIMITED TEXT free camcorder Reply or call now 08000930705 Del Thurs,1
I tagged MY friends that you seemed to count as YOUR friends.,0
"aight we can pick some up, you open before tonight?",0
Dad went out oredi... ,0
Your board is working fine. The issue of overheating is also reslove. But still software inst is pending. I will come around 8'o clock.,0
You have won a Nokia 7250i. This is what you get when you win our FREE auction. To take part send Nokia to 86021 now. HG/Suite342/2Lands Row/W1JHL 16+ ,1
"Got what it takes 2 take part in the WRC Rally in Oz? U can with Lucozade Energy! Text RALLY LE to 61200 (25p), see packs or lucozade.co.uk/wrc & itcould be u!",1
"I sent my scores to sophas and i had to do secondary application for a few schools. I think if you are thinking of applying, do a research on cost also. Contact joke ogunrinde, her school is one me the less expensive ones",0
"Say this slowly.? GOD,I LOVE YOU &amp; I NEED YOU,CLEAN MY HEART WITH YOUR BLOOD.Send this to Ten special people &amp; u c miracle tomorrow, do it,pls,pls do it...",0
great princess! I love giving and receiving oral. Doggy style is my fave position. How about you? I enjoy making love  &lt;#&gt;  times per night :),0
(You didn't hear it from me),0
Babe !!!! I LOVE YOU !!!! *covers your face in kisses*,0
Huh y lei...,0
Fine. Do you remember me.,0
Just woke up. Yeesh its late. But I didn't fall asleep til &lt;#&gt; am :/,0
Reckon need to be in town by eightish to walk from * carpark.,0
Where at were hungry too,0
ELLO BABE U OK?,0
Can you open the door?,0
"Sir, I have been late in paying rent for the past few months and had to pay a $ &lt;#&gt;  charge. I felt it would be inconsiderate of me to nag about something you give at great cost to yourself and that's why i didnt speak up. I however am in a recession and wont be able to pay the charge this month hence my askin well ahead of month's end. Can you please help. Thanks",0
Dear we got  &lt;#&gt;  dollars hi hi,0
I'll be at mu in like  &lt;#&gt;  seconds,0
"A boy was late 2 home. His father: ""POWER OF FRNDSHIP""",0
alright. Thanks for the advice. Enjoy your night out. I'ma try to get some sleep...,0
If I die I want u to have all my stuffs.,0
Whos this am in class:-),0
We are okay. Going to sleep now. Later,0
Buy Space Invaders 4 a chance 2 win orig Arcade Game console. Press 0 for Games Arcade (std WAP charge) See o2.co.uk/games 4 Terms + settings. No purchase,1
Tell your friends what you plan to do on Valentines day @ &lt;URL&gt;,0
He's really into skateboarding now despite the fact that he gets thrown off of it and winds up with bandages and shit all over his arms every five minutes,0
Not able to do anything.,0
Having lunch:)you are not in online?why?,0
Doc prescribed me morphine cause the other pain meds aren't enough. Waiting for my mom to bring it. That med should kick in fast so I'm gonna try to be on later,0
Got smaller capacity one? Quite ex...,0
You got called a tool?,0
Ay wana meet on sat?ü wkg on sat?,0
Pls speak to that customer machan.,0
Ugh its been a long day. I'm exhausted. Just want to cuddle up and take a nap,0
Bring home some Wendy =D,0
This phone has the weirdest auto correct.,0
I had askd u a question some hours before. Its answer,0
"K, can I pick up another 8th when you're done?",0
"Alright if you're sure, let me know when you're leaving",0
"Do you know why god created gap between your fingers..? So that, One who is made for you comes &amp; fills those gaps by holding your hand with LOVE..!",0
"I just lov this line: ""Hurt me with the truth, I don't mind,i wil tolerat.bcs ur my someone..... But, Never comfort me with a lie"" gud ni8 and sweet dreams",0
"YOU 07801543489 are guaranteed the latests Nokia Phone, a 40GB iPod MP3 player or a £500 prize! Txt word:COLLECT to No:83355! TC-LLC NY-USA 150p/Mt msgrcvd18+",1
"Okies... I'll go yan jiu too... We can skip ard oso, go cine den go mrt one, blah blah blah... ",0
U don't remember that old commercial?,0
Huh means computational science... Y they like dat one push here n there...,0
I keep ten rs in my shelf:) buy two egg.,0
"That's what I love to hear :V see you sundayish, then",0
"Indians r poor but India is not a poor country. Says one of the swiss bank directors. He says that "" &lt;#&gt;  lac crore"" of Indian money is deposited in swiss banks which can be used for 'taxless' budget for  &lt;#&gt;  yrs. Can give  &lt;#&gt;  crore jobs to all Indians. From any village to Delhi 4 lane roads. Forever free power suply to more than  &lt;#&gt;  social projects. Every citizen can get monthly  &lt;#&gt; /- for  &lt;#&gt;  yrs. No need of World Bank &amp; IMF loan. Think how our money is blocked by rich politicians. We have full rights against corrupt politicians. Itna forward karo ki pura INDIA padhe.g.m.""",0
"complimentary 4 STAR Ibiza Holiday or £10,000 cash needs your URGENT collection. 09066364349 NOW from Landline not to lose out! Box434SK38WP150PPM18+",1
Congratulations YOU'VE Won. You're a Winner in our August £1000 Prize Draw. Call 09066660100 NOW. Prize Code 2309.,1
Keep yourself safe for me because I need you and I miss you already and I envy everyone that see's you in real life,0
Po de :-):):-):-):-). No need job aha.,0
Ok,0
Match started.india  &lt;#&gt;  for 2,0
Raviyog Peripherals bhayandar east,0
ree entry in 2 a weekly comp for a chance to win an ipod. Txt POD to 80182 to get entry (std txt rate) T&C's apply 08452810073 for details 18+,1
Congrats! Nokia 3650 video camera phone is your Call 09066382422 Calls cost 150ppm Ave call 3mins vary from mobiles 16+ Close 300603 post BCM4284 Ldn WC1N3XX,1
U have a secret admirer who is looking 2 make contact with U-find out who they R*reveal who thinks UR so special-call on 09058094599,1
"Aight, we'll head out in a few",0
So that takes away some money worries,0
Hello! How's you and how did saturday go? I was just texting to see if you'd decided to do anything tomo. Not that i'm trying to invite myself or anything!,0
"Do you know why god created gap between your fingers..? So that, One who is made for you comes &amp; fills those gaps by holding your hand with LOVE..!",0
He says he'll give me a call when his friend's got the money but that he's definitely buying before the end of the week,0
Please call our customer service representative on FREEPHONE 0808 145 4742 between 9am-11pm as you have WON a guaranteed £1000 cash or £5000 prize!,1
Thank u!,0
He also knows about lunch menu only da. . I know,0
BABE !!! I miiiiiiissssssssss you ! I need you !!! I crave you !!! :-( ... Geeee ... I'm so sad without you babe ... I love you ...,0
I wish! I don't think its gonna snow that much. But it will be more than those flurries we usually get that melt before they hit the ground. Eek! We haven't had snow since &lt;#&gt; before I was even born!,0
I probably won't eat at all today. I think I'm gonna pop. How was your weekend? Did u miss me?,0
That's significant but dont worry.,0
"Hack Chat. Get backdoor entry into 121 chat rooms at a fraction of the cost. Reply NEO69 or call 09050280520, to subscribe 25p pm. DPS, Bcm box 8027 Ldn, wc1n3xx",1
"Thank you so much. When we skyped wit kz and sura, we didnt get the pleasure of your company. Hope you are good. We've given you ultimatum oh! We are countin down to aburo. Enjoy! This is the message i sent days ago",0
I'm in a movie. Call me 4 wat?,0
K. I will sent it again,0
You are not bothering me but you have to trust my answers. Pls.,0
Fancy a shag? I do.Interested? sextextuk.com txt XXUK SUZY to 69876. Txts cost 1.50 per msg. TnCs on website. X,1
I will reach office around  &lt;DECIMAL&gt; . &amp; my mobile have problem. You cann't get my voice. So call you asa i'll free,0
Just got to  &lt;#&gt;,0
"'Wnevr i wana fal in luv vth my books, My bed fals in luv vth me..!'' . Yen madodu, nav pretsorginta, nammanna pretsovru important alwa....!!:) Gud eveB-).",0
I know she called me,0
"Goodmorning, Today i am late for  &lt;#&gt; min.",0
Lol yes. But it will add some spice to your day.,0
Thanks for your message. I really appreciate your sacrifice. I'm not sure of the process of direct pay but will find out on my way back from the test tomorrow. I'm in class now. Do have a wonderful day.,0
Aight sorry I take ten years to shower. What's the plan?,0
"Yeah probably, I still gotta check out with leo",0
Jay is snickering and tells me that x is totally fucking up the chords as we speak,0
"Thanx 4 the time weve spent 2geva, its bin mint! Ur my Baby and all I want is u!xxxx",0
I'm home.,0
Be sure to check your yahoo email. We sent photos yesterday,0
Congratulations ur awarded 500 of CD vouchers or 125gift guaranteed & Free entry 2 100 wkly draw txt MUSIC to 87066 TnCs www.Ldew.com1win150ppmx3age16,1
"Nah man, my car is meant to be crammed full of people",0
"Today is ""song dedicated day.."" Which song will u dedicate for me? Send this to all ur valuable frnds but first rply me...",0
Eat jap done oso aft ur lect wat... Ü got lect at 12 rite... ,0
Thought praps you meant another one. Goodo! I'll look tomorrow ,0
"As usual..iam fine, happy &amp; doing well..:)",0
"Hello, hello, hi lou sorry it took so long 2 reply- I left mobile at friends in Lancaster, just got it bak Neway im sorry I couldnt make ur bday 2 hun!",0
"Sorry, I can't text &amp; drive coherently, see you in twenty",0
No problem baby. Is this is a good time to talk? I called and left a message.,0
Am slow in using biola's fne,0
Ryder unsold.now gibbs.,0
Congratulations ur awarded 500 of CD vouchers or 125gift guaranteed & Free entry 2 100 wkly draw txt MUSIC to 87066,1
S now only i took tablets . Reaction morning only.,0
Hey now am free you can call me.,0
ok. I am a gentleman and will treat you with dignity and respect.,0
But i'm really really broke oh. No amount is too small even  &lt;#&gt; ,0
Cool. Do you like swimming? I have a pool and jacuzzi at my house.,0
"Well imma definitely need to restock before thanksgiving, I'll let you know when I'm out",0
"URGENT! Last weekend's draw shows that you have won £1000 cash or a Spanish holiday! CALL NOW 09050000332 to claim. T&C: RSTM, SW7 3SS. 150ppm",1
You will be in the place of that man,0
I will reach ur home in  &lt;#&gt;  minutes,0
These won't do. Have to move on to morphine,0
Yup bathe liao...,0
Ü comin to fetch us oredi...,0
Then get some cash together and I'll text jason,0
