message,target
What do U want for Xmas? How about 100 free text messages & a new video phone with half price line rental? Call free now on 0800 0721072 to find out more!,1
I just really need shit before tomorrow and I know you won't be awake before like 6,0
Raji..pls do me a favour. Pls convey my Birthday wishes to Nimya. Pls. Today is her birthday.,0
"Cool, I'll text you in a few",0
Check audrey's status right now,0
Thanx 4 2day! U r a goodmate I THINK UR RITE SARY! ASUSUAL!1 U CHEERED ME UP! LOVE U FRANYxxxxx,0
You are gorgeous! keep those pix cumming :) thank you!,0
Ya i knw u vl giv..its ok thanks kano..anyway enjoy wit ur family wit 1st salary..:-);-),0
Eh den sat u book e kb liao huh...,0
"K, if u bored up just come to my home..",0
Shall i ask one thing if you dont mistake me.,0
1. Tension face 2. Smiling face 3. Waste face 4. Innocent face 5.Terror face 6.Cruel face 7.Romantic face 8.Lovable face 9.decent face  &lt;#&gt; .joker face.,0
Dai what this da.. Can i send my resume to this id.,0
They are just making it easy to pay back. I have  &lt;#&gt; yrs to say but i can pay back earlier. You get?,0
Great. So should i send you my account number.,0
"Do 1 thing! Change that sentence into: ""Because i want 2 concentrate in my educational career im leaving here..""",0
Are you there in room.,0
Finish liao... U?,0
get ready to moan and scream :),0
U too...,0
I hope you arnt pissed off but id would really like to see you tomorrow. Love me xxxxxxxxxxxxxX,0
Okie...,0
WHEN THE FIRST STRIKE IS A RED ONE. THE BIRD + ANTELOPE BEGIN TOPLAY IN THE FIELDOF SELFINDEPENDENCE BELIEVE THIS + THE FLOWER OF CONTENTION WILL GROW.RANDOM!,0
Watch lor. I saw a few swatch one i thk quite ok. Ard 116 but i need 2nd opinion leh...,0
Do you want a NEW video phone750 anytime any network mins 150 text for only five pounds per week call 08000776320 now or reply for delivery tomorrow,1
Pls dont forget to study,0
Uhhhhrmm isnt having tb test bad when youre sick,0
Dont show yourself. How far. Put new pictures up on facebook.,0
Have you laid your airtel line to rest?,0
No problem. How are you doing?,0
How much is blackberry bold2 in nigeria.,0
Let there be snow. Let there be snow. This kind of weather brings ppl together so friendships can grow.,0
"That‘s the thing with apes, u can fight to the death to keep something, but the minute they have it when u let go, thats it!",0
I can't describe how lucky you are that I'm actually awake by noon,0
Are there TA jobs available? Let me know please cos i really need to start working,0
Want the latest Video handset? 750 anytime any network mins? Half price line rental? Reply or call 08000930705 for delivery tomorrow,1
I to am looking forward to all the sex cuddling.. Only two more sleeps ,0
"Just so that you know,yetunde hasn't sent money yet. I just sent her a text not to bother sending. So its over, you dont have to involve yourself in anything. I shouldn't have imposed anything on you in the first place so for that, i apologise.",0
Yes i thought so. Thanks.,0
From 5 to 2 only my work timing.,0
Yup... From what i remb... I think should be can book... ,0
How have your little darlings been so far this week? Need a coffee run tomo?Can't believe it's that time of week already …,0
My battery is low babe,0
Gud ni8.swt drms.take care,0
"Damn, can you make it tonight or do you want to just wait til tomorrow",0
Oh k. . I will come tomorrow,0
ARE YOU IN TOWN? THIS IS V. IMPORTANT,0
Delhi and chennai still silent.,0
"Good afternoon, babe. How goes that day ? Any job prospects yet ? I miss you, my love ... *sighs* ... :-(",0
Waiting 4 my tv show 2 start lor... U leh still busy doing ur report?,0
"Dont pack what you can buy at any store.like cereals. If you must pack food, pack gari or something 9ja that you will miss.",0
I accidentally brought em home in the box,0
Den wat will e schedule b lk on sun?,0
GSOH? Good with SPAM the ladies?U could b a male gigolo? 2 join the uk's fastest growing mens club reply ONCALL. mjzgroup. 08714342399.2stop reply STOP. msg@£1.50rcvd,1
I want to tel u one thing u should not mistake me k THIS IS THE MESSAGE THAT YOU SENT:),0
Are you not around or just still asleep? :V,0
Hey i've booked the pilates and yoga lesson already... Haha,0
Midnight at the earliest,0
Hi dis is yijue i would be happy to work wif ü all for gek1510...,0
What you did in  leave.,0
"Its ok, if anybody asks abt me, u tel them..:-P",0
Yes..he is really great..bhaji told kallis best cricketer after sachin in world:).very tough to get out.,0
Dunno lei he neva say...,0
Ok lor thanx... Ü in school?,0
How come she can get it? Should b quite diff to guess rite...,0
Do you mind if I ask what happened? You dont have to say if it is uncomfortable.,0
"What will we do in the shower, baby?",0
No my mum went 2 dentist.,0
Kit Strip - you have been billed 150p. Netcollex Ltd. PO Box 1013 IG11 OJA,1
No message..no responce..what happend?,0
Are you angry with me. What happen dear,0
I would but I'm still cozy. And exhausted from last night.nobody went to school or work. Everything is closed.,0
"Dont worry, 1 day very big lambu ji vl come..til then enjoy batchlor party:-)",0
Huh so late... Fr dinner?,0
"Hello baby, did you get back to your mom's ? Are you setting up the computer now ? Filling your belly ? How goes it loverboy ? I miss you already ... *sighs*",0
Its going good...no problem..but still need little experience to understand american customer voice...,0
Thk some of em find wtc too far... Weiyi not goin... E rest i dunno yet... R ur goin 4 dinner den i might b able to join...,0
"Height of Confidence: All the Aeronautics professors wer calld &amp; they wer askd 2 sit in an aeroplane. Aftr they sat they wer told dat the plane ws made by their students. Dey all hurried out of d plane.. Bt only 1 didnt move... He said:""if it is made by my students,this wont even start........ Datz confidence..",0
Okay. I've seen it. So i should pick it on friday?,0
IM FINE BABES AINT BEEN UP 2 MUCH THO! SAW SCARY MOVIE YEST ITS QUITE FUNNY! WANT 2MRW AFTERNOON? AT TOWN OR MALL OR SUMTHIN?xx,0
So i'm doing a list of buyers.,0
Can't. I feel nauseous. I'm so pissed. I didn't eat any sweets all week cause today I was planning to pig out. I was dieting all week. And now I'm not hungry :/,0
"Yetunde, i'm sorry but moji and i seem too busy to be able to go shopping. Can you just please find some other way to get what you wanted us to get. Please forgive me. You can reply free via yahoo messenger.",0
Will ü b going to esplanade fr home?,0
"The world is running and i am still.maybe all are feeling the same,so be it.or i have to admit,i am mad.then where is the correction?or let me call this is life.and keep running with the world,may be u r also running.lets run.",0
I'm done...,0
He also knows about lunch menu only da. . I know,0
Not a drop in the tank,0
Just sent it. So what type of food do you like?,0
Uncle Abbey! Happy New Year. Abiola,0
"SMSSERVICES. for yourinclusive text credits, pls goto www.comuk.net login= 3qxj9 unsubscribe with STOP, no extra charge. help 08702840625.COMUK. 220-CM2 9AE",1
It's ok lar. U sleep early too... Nite...,0
Id have to check but there's only like 1 bowls worth left,0
Only if you promise your getting out as SOON as you can. And you'll text me in the morning to let me know you made it in ok.,0
I'm in office now . I will call you  &lt;#&gt;  min:),0
"Me not waking up until 4 in the afternoon, sup",0
I wil be there with in  &lt;#&gt;  minutes. Got any space,0
Yup but it's not giving me problems now so mayb i'll jus leave it...,0
"Hey, I missed you tm of last night as my phone was on the charge ... *smiles* ... I am meeting a friend shortly",0
If you don't respond imma assume you're still asleep and imma start calling n shit,0
But that's on ebay it might be less elsewhere.,0
I think it's all still in my car,0
I don't know u and u don't know me. Send CHAT to 86688 now and let's find each other! Only 150p/Msg rcvd. HG/Suite342/2Lands/Row/W1J6HL LDN. 18 years or over.,1
Dhoni have luck to win some big title.so we will win:),0
K k :-):-) then watch some films.,0
"Xmas & New Years Eve tickets are now on sale from the club, during the day from 10am till 8pm, and on Thurs, Fri & Sat night this week. They're selling fast!",1
"Today's Offer! Claim ur £150 worth of discount vouchers! Text YES to 85023 now! SavaMob, member offers mobile! T Cs 08717898035. £3.00 Sub. 16 . Unsub reply X",1
"Come round, it's . ",0
my ex-wife was not able to have kids. Do you want kids one day?,0
Ok but knackered. Just came home and went to sleep! Not good at this full time work lark.,0
Ill be there on  &lt;#&gt;  ok.,0
"Sad story of a Man - Last week was my b'day. My Wife did'nt wish me. My Parents forgot n so did my Kids . I went to work. Even my Colleagues did not wish. As I entered my cabin my PA said, '' Happy B'day Boss !!''. I felt special. She askd me 4 lunch. After lunch she invited me to her apartment. We went there. She said,'' do u mind if I go into the bedroom for a minute ? '' ''OK'', I sed in a sexy mood. She came out 5 minuts latr wid a cake...n My Wife, My Parents, My Kidz, My Friends n My Colleagues. All screaming.. SURPRISE !! and I was waiting on the sofa.. ... ..... ' NAKED...!",0
WOT STUDENT DISCOUNT CAN U GET ON BOOKS?,0
I am hot n horny and willing I live local to you - text a reply to hear strt back from me 150p per msg Netcollex LtdHelpDesk: 02085076972 reply Stop to end,1
Hey! do u fancy meetin me at 4 at cha  hav a lil beverage on me. if not txt or ring me and we can meet up l8r. quite tired got in at 3 v.pist ;) love Pete x x x,0
Alrite jod hows the revision goin? Keris bin doin a smidgin. N e way u wanna cum over after college?xx,0
Free entry in 2 a weekly comp for a chance to win an ipod. Txt POD to 80182 to get entry (std txt rate) T&C's apply 08452810073 for details 18+,1
Wot u up 2? Thout u were gonna call me!! Txt bak luv K,0
"Kate jackson rec center before 7ish, right?",0
Sorry i now then c ur msg... Yar lor so poor thing... But only 4 one night... Tmr u'll have a brand new room 2 sleep in...,0
"The sign of maturity is not when we start saying big things.. But actually it is, when we start understanding small things... *HAVE A NICE EVENING* BSLVYL",0
Do you always celebrate NY's with your family ?,0
"Go until jurong point, crazy.. Available only in bugis n great world la e buffet... Cine there got amore wat...",0
Good night my dear.. Sleepwell&amp;Take care,0
Yep. I do like the pink furniture tho.,0
"7 wonders in My WORLD 7th You 6th Ur style 5th Ur smile 4th Ur Personality 3rd Ur Nature 2nd Ur SMS and 1st ""Ur Lovely Friendship""... good morning dear",0
Are you happy baby ? Are you alright ? Did you take that job ? I hope your fine. I send you a kiss to make you smile from across the sea ... *kiss* *kiss*,0
For me the love should start with attraction.i should feel that I need her every time around me.she should be the first thing which comes in my thoughts.I would start the day and end it with her.she should be there every time I dream.love will be then when my every breath has her name.my life should happen around her.my life will be named to her.I would cry for her.will give all my happiness and take all her sorrows.I will be ready to fight with anyone for her.I will be in love when I will be doing the craziest things for her.love will be when I don't have to proove anyone that my girl is the most beautiful lady on the whole planet.I will always be singing praises for her.love will be when I start up making chicken curry and end up makiing sambar.life will be the most beautiful then.will get every morning and thank god for the day because she is with me.I would like to say a lot..will tell later..,0
"Hi there, 2nights ur lucky night! Uve been invited 2 XCHAT, the Uks wildest chat! Txt CHAT to 86688 now! 150p/MsgrcvdHG/Suite342/2Lands/Row/W1J6HL LDN 18yrs",1
Discussed with your mother ah?,0
Ya but it cant display internal subs so i gotta extract them,0
An excellent thought by a misundrstud frnd: I knw u hate me bt the day wen u'll knw the truth u'll hate urself:-( Gn:-),0
If I get there before you after your ten billion calls and texts so help me god,0
You're gonna have to be way more specific than that,0
"I think I‘m waiting for the same bus! Inform me when you get there, if you ever get there.",0
No rushing. I'm not working. I'm in school so if we rush we go hungry.,0
"Just gettin a bit arty with my collages at the mo, well tryin 2 ne way! Got a roast in a min lovely i shall enjoy that!",0
Customer service annoncement. You have a New Years delivery waiting for you. Please call 07046744435 now to arrange delivery,1
You have to pls make a note of all she.s exposed to. Also find out from her school if anyone else was vomiting. Is there a dog or cat in the house? Let me know later.,0
Don't fret. I'll buy the ovulation test strips and send them to you. You wont get them til like march. Can you send me your postal address.u'll be alright.Okay.,0
"Good afternoon loverboy ! How goes you day ? Any luck come your way? I think of you, sweetie and send my love across the sea to make you smile and happy",0
"Me, i dont know again oh",0
"Finally it has happened..! Aftr decades..! BEER is now cheaper than PETROL! The goverment expects us to ""DRINK"". . . But don't ""DRIVE """,0
Quite ok but a bit ex... U better go eat smth now else i'll feel guilty...,0
That's y we haf to combine n c how lor...,0
Oi. Ami parchi na re. Kicchu kaaj korte iccha korche na. Phone ta tul na. Plz. Plz.,0
"Hello, yeah i've just got out of the bath and need to do my hair so i'll come up when i'm done, yeah?",0
"HELLOGORGEOUS, HOWS U? MY FONE WAS ON CHARGE LST NITW WEN U TEXD ME. HOPEU AD A NICE WKEND AS IM SURE U DID LOOKIN 4WARD 2 C-IN U 2MRW LUV JAZ",0
"It doesnt make sense to take it there unless its free. If you need to know more, wikipedia.com",0
hi my darlin im on my way to London and we have just been smashed into by another driver! and have a big dent! im really missing u what have u been up to? xxx,0
Last chance 2 claim ur £150 worth of discount vouchers-Text YES to 85023 now!SavaMob-member offers mobile T Cs 08717898035. £3.00 Sub. 16 . Remove txt X or STOP,1
"Lol you forgot it eh ? Yes, I'll bring it in babe",0
"Well, i'm glad you didn't find it totally disagreeable ... Lol",0
Oh k.k..where did you take test?,0
"I wonder how you got online, my love ? Had you gone to the net cafe ? Did you get your phone recharged ? Were you on a friends net ? I think of you, boytoy",0
Pls help me tell sura that i'm expecting a battery from hont. And that if should pls send me a message about how to download movies. Thanks,0
Jay says that you're a double-faggot,0
"URGENT! Your Mobile No 07808726822 was awarded a £2,000 Bonus Caller Prize on 02/09/03! This is our 2nd attempt to contact YOU! Call 0871-872-9758 BOX95QU",1
Ok but tell me half an hr b4 u come i need 2 prepare.,0
Here is your discount code RP176781. To stop further messages reply stop. www.regalportfolio.co.uk. Customer Services 08717205546,1
"Night sweet, sleep well! I've just been to see The Exorcism of Emily Rose and may never sleep again! Hugs and snogs! ",0
Ugh I don't wanna get out of bed. It's so warm.,0
I cant wait for cornwall. Hope tonight isnt too bad as well but its rock night shite. Anyway im going for a kip now have a good night. Speak to you soon.,0
Stop calling everyone saying I might have cancer. My throat hurts to talk. I can't be answering everyones calls. If I get one more call I'm not babysitting on Monday,0
"Vikky, come around  &lt;TIME&gt; ..",0
"Yeah I am, so I'll leave maybe 7ish?",0
At WHAT TIME should i come tomorrow,0
"Hello my boytoy ... Geeee I miss you already and I just woke up. I wish you were here in bed with me, cuddling me. I love you ...",0
FreeMsg Hi baby wow just got a new cam moby. Wanna C a hot pic? or Fancy a chat?Im w8in 4uTxt / rply CHAT to 82242 Hlp 08712317606 Msg150p 2rcv,1
Update your face book status frequently :),0
V nice! Off 2 sheffield tom 2 air my opinions on categories 2 b used 2 measure ethnicity in next census. Busy transcribing. :-),0
"Same here, but I consider walls and bunkers and shit important just because I never play on peaceful but I guess your place is high enough that it don't matter",0
I know girls always safe and selfish know i got it pa. Thank you. good night.,0
You still at the game?,0
"Hi, Mobile no.  &lt;#&gt;  has added you in their contact list on www.fullonsms.com It s a great place to send free sms to people For more visit fullonsms.com",0
U sick still can go shopping?,0
"Imagine you finally get to sink into that bath after I have put you through your paces, maybe even having you eat me for a while before I left ... But also imagine the feel of that cage on your cock surrounded by the bath water, reminding you always who owns you ... Enjoy, my cuck",0
You are a great role model. You are giving so much and i really wish each day for a miracle but God as a reason for everything and i must say i wish i knew why but i dont. I've looked up to you since i was young and i still do. Have a great day.,0
Yetunde i'm in class can you not run water on it to make it ok. Pls now.,0
Ok,0
"Plz note: if anyone calling from a mobile Co. &amp; asks u to type # &lt;#&gt;  or # &lt;#&gt; . Do not do so. Disconnect the call,coz it iz an attempt of 'terrorist' to make use of the sim card no. Itz confirmd by nokia n motorola n has been verified by CNN IBN.",0
Let me know when you've got the money so carlos can make the call,0
"Trust me. Even if isn't there, its there.",0
YES! The only place in town to meet exciting adult singles is now in the UK. Txt CHAT to 86688 now! 150p/Msg.,1
Do you want a New Nokia 3510i colour phone DeliveredTomorrow? With 300 free minutes to any mobile + 100 free texts + Free Camcorder reply or call 08000930705,1
Okie,0
Its good to hear from you,0
I dont have any of your file in my bag..i was in work when you called me.i 'll tell you if i find anything in my room.,0
K.k:)i'm going to tirunelvali this week to see my uncle ..i already spend the amount by taking dress .so only i want money.i will give it on feb 1,0
Love you aathi..love u lot..,0
Ok ok take care. I can understand.,0
Nite...,0
Boo. How's things? I'm back at home and a little bored already :-(,0
Nope i'm not drivin... I neva develop da photos lei...,0
For real tho this sucks. I can't even cook my whole electricity is out. And I'm hungry.,0
"A swt thought: ""Nver get tired of doing little things 4 lovable persons.."" Coz..somtimes those little things occupy d biggest part in their Hearts.. Gud ni8",0
What's your room number again? Wanna make sure I'm knocking on the right door,0
If u laugh really loud.. If u talk spontaneously.. If u dont care what others feel.. U are probably with your dear &amp; best friends.. GOODEVENING Dear..:),0
Watching tv now. I got new job :),0
Yo come over carlos will be here soon,0
"Cool, want me to go to kappa or should I meet you outside mu",0
Someone has contacted our dating service and entered your phone because they fancy you! To find out who it is call from a landline 09111032124 . PoBox12n146tf150p,1
Natalja (25/F) is inviting you to be her friend. Reply YES-440 or NO-440 See her: www.SMS.ac/u/nat27081980 STOP? Send STOP FRND to 62468,1
I just made some payments so dont have that much. Sorry. Would you want it fedex or the other way.,0
Bugis oso near wat... ,0
Prabha..i'm soryda..realy..frm heart i'm sory,0
Ok give me 5 minutes I think I see her. BTW you're my alibi. You were cutting my hair the whole time.,0
Jus finish my lunch on my way home lor... I tot u dun wan 2 stay in sch today...,0
"Give her something to drink, if she takes it and doesn't vomit then you her temp might drop. If she unmits however let me know.",0
No I don't have cancer. Moms making a big deal out of a regular checkup aka pap smear,0
I'm at home. Please call,0
"I'm not smoking while people use ""wylie smokes too much"" to justify ruining my shit",0
"Sad story of a Man - Last week was my b'day. My Wife did'nt wish me. My Parents forgot n so did my Kids . I went to work. Even my Colleagues did not wish. As I entered my cabin my PA said, '' Happy B'day Boss !!''. I felt special. She askd me 4 lunch. After lunch she invited me to her apartment. We went there. She said,'' do u mind if I go into the bedroom for a minute ? '' ''OK'', I sed in a sexy mood. She came out 5 minuts latr wid a cake...n My Wife, My Parents, My Kidz, My Friends n My Colleagues. All screaming.. SURPRISE !! and I was waiting on the sofa.. ... ..... ' NAKED...!",0
"And very importantly, all we discuss is between u and i only.",0
Oh yes I can speak txt 2 u no! Hmm. Did u get  email?,0
I'll meet you in the lobby,0
Poor girl can't go one day lmao,0
Moji i love you more than words. Have a rich day,0
"Only just got this message, not ignoring you. Yes, i was. Shopping that is",0
For sale - arsenal dartboard. Good condition but no doubles or trebles!,1
aathi..where are you dear..,0
I thk u dun haf 2 hint in e forum already lor... Cos i told ron n darren is going 2 tell shuhui.,0
Will do. Have a good day,0
Ok no prob. Take ur time.,0
"Sorry,in meeting I'll call later",0
YOU HAVE WON! As a valued Vodafone customer our computer has picked YOU to win a £150 prize. To collect is easy. Just call 09061743386,1
Dunno y u ask me.,0
If you hear a loud scream in about &lt;#&gt; minutes its cause my Gyno will be shoving things up me that don't belong :/,0
2 laptop... I noe infra but too slow lar... I wan fast one,0
Heart is empty without love.. Mind is empty without wisdom.. Eyes r empty without dreams &amp; Life is empty without frnds.. So Alwys Be In Touch. Good night &amp; sweet dreams,0
Lol I would but despite these cramps I like being a girl.,0
Huh? 6 also cannot? Then only how many mistakes?,0
Ya srsly better than yi tho,0
"URGENT. Important information for 02 user. Today is your lucky day! 2 find out why , log onto http://www.urawinner.com there is a fantastic surprise awaiting you !",1
"Ask g or iouri, I've told the story like ten times already",0
"Did you hear about the new ""Divorce Barbie""? It comes with all of Ken's stuff!",1
Are you plans with your family set in stone ?,0
"Mila, age23, blonde, new in UK. I look sex with UK guys. if u like fun with me. Text MTALK to 69866.18 . 30pp/txt 1st 5free. £1.50 increments. Help08718728876",1
Ok thanx... Take care then...,0
Give me a sec to think think about it,0
I am in bus on the way to calicut,0
"Haha awesome, I might need to take you up on that, what you doin tonight?",0
Was just about to ask. Will keep this one. Maybe that's why you didn't get all the messages we sent you on glo,0
Those were my exact intentions,0
"That's fine, I'll bitch at you about it later then",0
This girl does not stay in bed. This girl doesn't need recovery time. Id rather pass out while having fun then be cooped up in bed,0
", im .. On the snowboarding trip. I was wondering if your planning to get everyone together befor we go..a meet and greet kind of affair? Cheers, ",0
This is hoping you enjoyed your game yesterday. Sorry i've not been in touch but pls know that you are fondly bein thot off. Have a great week. Abiola,0
Ok lor...,0
Are you still playing with gautham?,0
Some of them told accenture is not confirm. Is it true.,0
"I.ll always be there, even if its just in spirit. I.ll get a bb soon. Just trying to be sure i need it.",0
No way I'm going back there!,0
No pic. Please re-send.,0
Hello! How r u? Im bored. Inever thought id get bored with the tv but I am. Tell me something exciting has happened there? Anything! =/,0
Tell me something. Thats okay.,0
Ü say until like dat i dun buy ericsson oso cannot oredi lar...,0
"Good afternoon, my boytoy ... How are you feeling today ? Better I hope? Are you being my good boy? Are you my obedient, slave? Do you please your Queen?",0
+123 Congratulations - in this week's competition draw u have won the £1450 prize to claim just call 09050002311 b4280703. T&Cs/stop SMS 08718727868. Over 18 only 150ppm,1
Ok both our days. So what are you making for dinner tonite? Am I invited?,0
Not heard from U4 a while. Call 4 rude chat private line 01223585334 to cum. Wan 2C pics of me gettin shagged then text PIX to 8552. 2End send STOP 8552 SAM xxx,1
I‘ll have a look at the frying pan in case it‘s cheap or a book perhaps. No that‘s silly a frying pan isn‘t likely to be a book,0
Leave it. U will always be ignorant.,0
We stopped to get ice cream and will go back after,0
"yeah, that's what I was thinking",0
Then anything special?,0
R ü going 4 today's meeting?,0
MY NO. IN LUTON 0125698789 RING ME IF UR AROUND! H*,0
Bull. Your plan was to go floating off to IKEA with me without a care in the world. So i have to live with your mess another day.,0
Send me your id and password,0
I was gonna ask you lol but i think its at 7,0
Wah... Okie okie... Muz make use of e unlimited... Haha... ,0
If You mean the website. Yes.,0
"Hi babe its Jordan, how r u? Im home from abroad and lonely, text me back if u wanna chat xxSP visionsms.com Text stop to stopCost 150p 08712400603",1
S:)but he had some luck.2 catches put down:),0
This message is free. Welcome to the new & improved Sex & Dogging club! To unsubscribe from this service reply STOP. msgs@150p 18+only,1
Send a logo 2 ur lover - 2 names joined by a heart. Txt LOVE NAME1 NAME2 MOBNO eg LOVE ADAM EVE 07123456789 to 87077 Yahoo! POBox36504W45WQ TxtNO 4 no ads 150p,1
Or just do that 6times,0
Then its most likely called Mittelschmertz. Google it. If you dont have paracetamol dont worry it will go.,0
Sorry completely forgot * will pop em round this week if your still here?,0
Ok lor.,0
